{
  "type": "guide",
  "slug": "meals-from-pantry-staples-a-simple-system-for-better-last-minute-dinners",
  "category": "pantry",
  "card_blurb": "A simple system for making last-minute dinners from pantry staples, fridge leftovers, sauces, and flexible meal templates.",
  "breadcrumb": "Meals From Pantry Staples: A Simple System for Better Last-M",
  "eyebrow": "Pantry",
  "title": "Meals From Pantry Staples: A Simple System for Better Last-Minute Dinners",
  "description": "A simple system for making last-minute dinners from pantry staples, fridge leftovers, sauces, and flexible meal templates.",
  "h1": "Meals From Pantry Staples: A Simple System for Better Last-Minute Dinners",
  "intro": [
    "The phrase “pantry staples” sounds boring until it is 7pm and they are the only reason dinner is still possible.",
    "A good pantry is not about having every ingredient. It is about having enough building blocks to turn small fridge leftovers into a meal. Rice, pasta, beans, lentils, tinned tomatoes, noodles, flour, eggs, frozen vegetables, spices, and a few sauces can stretch further than most people think.",
    "Here is a simple system for turning pantry staples into dinner without needing a perfect recipe."
  ],
  "sections": [
    {
      "heading": "Start with the role, not the recipe",
      "paragraphs": [
        "When you look at an ingredient, ask what role it can play.",
        "- **Base:** rice, pasta, noodles, potatoes, bread, wraps, grains.",
        "- **Protein or filling:** beans, chickpeas, lentils, eggs, tuna, tofu, cheese, yoghurt.",
        "- **Sauce or moisture:** tinned tomatoes, stock, coconut milk, pesto, soy sauce, cream cheese, olive oil, yoghurt.",
        "- **Flavour:** garlic, onion, spices, herbs, lemon, vinegar, chilli, mustard.",
        "- **Texture:** seeds, nuts, breadcrumbs, crispy onions, salad, pickles.",
        "Once you know the role, dinner becomes easier to assemble."
      ]
    },
    {
      "heading": "Five pantry templates that rarely fail",
      "paragraphs": [
        "1. The bowl",
        "Use rice, grains, couscous, potatoes, or noodles as the base. Add beans, eggs, tofu, chicken, cheese, or leftovers. Add vegetables, then finish with a sauce.",
        "Good combinations:",
        "- Rice, black beans, corn, tomato, yoghurt, hot sauce.",
        "- Couscous, chickpeas, cucumber, feta, lemon dressing.",
        "- Noodles, egg, frozen peas, soy sauce, sesame oil.",
        "2. The pasta save",
        "Pasta can handle tiny amounts of ingredients. A spoon of pesto, half a courgette, a few cherry tomatoes, a handful of frozen spinach, or leftover roast vegetables can become enough when you add pasta water and seasoning.",
        "If the sauce is too thin, add cheese, cream cheese, yoghurt, or blended beans. If it is too heavy, add lemon, herbs, or something green.",
        "3. The soup or stew",
        "Soup is the best format for odd vegetables, tinned tomatoes, lentils, beans, and stock. It turns “not enough for a meal” into something warm and complete.",
        "Add pasta, rice, potatoes, or bread on the side if you need it to be more filling.",
        "4. The egg dinner",
        "Eggs turn leftovers into dinner fast. Omelettes, frittatas, shakshuka-style eggs, egg fried rice, and breakfast-for-dinner plates all work with small ingredient amounts.",
        "Best add-ins: cooked potatoes, spinach, peppers, mushrooms, cheese, leftover rice, herbs, beans, and tomatoes.",
        "5. The wrap or toast plate",
        "When ingredients do not look like a recipe, put them in a wrap or on toast. Beans, cheese, eggs, roasted vegetables, tuna, salad, hummus, leftover chicken, or rice can all work.",
        "Add sauce. Add crunch. Dinner suddenly feels planned."
      ]
    },
    {
      "heading": "How to avoid buying more food when you do not need to",
      "paragraphs": [
        "Before shopping, check three places:",
        "1. The fridge: what needs using first? 2. The pantry: what can become the base? 3. The freezer: what can add vegetables or protein?",
        "Then build the meal around the ingredient most likely to go to waste."
      ]
    },
    {
      "heading": "The next time your pantry looks boring",
      "paragraphs": [
        "Do not ask, “What recipe can I make?” Ask, “What role can each ingredient play?”",
        "That small shift makes pantry cooking feel less like compromise and more like a useful dinner skill."
      ]
    }
  ],
  "delixio": {
    "heading": "Where Delixio helps",
    "paragraphs": [
      "Delixio is designed for exactly this kind of kitchen moment. Instead of starting from a recipe and shopping for missing ingredients, you start from what you already have. Type your ingredients, choose the kind of recipe inspiration you want, and save the ideas that work for later.",
      "You can also build a grocery list from recipes and plan meals on a calendar, which helps turn one good pantry save into a calmer week.",
      "Recipes are AI-assisted suggestions. Always check ingredients and allergens yourself before cooking or serving."
    ]
  },
  "related": [
    {
      "slug": "recipe-generator-from-ingredients",
      "label": "Recipe generator from ingredients",
      "type": "landing"
    },
    {
      "slug": "what-can-i-cook-with-these-ingredients",
      "label": "What can I cook with these ingredients?",
      "type": "landing"
    },
    {
      "slug": "fridge-recipe-app",
      "label": "Fridge recipe app",
      "type": "landing"
    }
  ]
}
