{
  "type": "guide",
  "slug": "how-a-leftover-recipe-generator-helps-you-waste-less-food",
  "category": "leftovers",
  "card_blurb": "Learn how a leftover recipe generator can turn fridge ingredients into practical meal ideas and help reduce everyday food waste.",
  "breadcrumb": "How a Leftover Recipe Generator Helps You Waste Less Food",
  "eyebrow": "Leftovers",
  "title": "How a Leftover Recipe Generator Helps You Waste Less Food",
  "description": "Learn how a leftover recipe generator can turn fridge ingredients into practical meal ideas and help reduce everyday food waste.",
  "h1": "How a Leftover Recipe Generator Helps You Waste Less Food",
  "intro": [
    "A good leftover recipe generator should not ask you to shop for a completely new dinner.",
    "It should start where real cooking starts: with the food already sitting in your fridge.",
    "Leftovers are not always obvious. You might have cooked rice, half a pepper, a spoon of yoghurt, roasted vegetables, a little cheese, and no idea how to connect them. A leftover recipe generator is useful when it turns that messy list into practical meal ideas."
  ],
  "sections": [
    {
      "heading": "The problem with searching for leftover recipes",
      "paragraphs": [
        "Traditional recipe search usually starts with the dish: fried rice, soup, pasta bake, curry, salad.",
        "But at home, the question is different:",
        "“What can I make with these exact things?”",
        "That is why leftover cooking often feels frustrating. You search for recipes, then discover you are missing three ingredients, or the recipe uses leftovers you do not have.",
        "A better tool should start from your kitchen, not from an ideal ingredient list."
      ]
    },
    {
      "heading": "What a useful leftover recipe generator should do",
      "paragraphs": [
        "Start from real ingredients",
        "You should be able to enter what you actually have: cooked rice, carrots, chickpeas, spinach, eggs, cheese, wraps, pasta, herbs, sauces, or leftovers from yesterday.",
        "The tool should help you see possible meals from those ingredients.",
        "Let you choose how flexible to be",
        "Sometimes you want to use only what is already there. Sometimes you are happy to add one or two extras.",
        "That difference matters.",
        "A strict mode is useful when you cannot shop. A flexible mode is useful when one extra ingredient could make dinner much better. A creative mode is useful when you want new combinations.",
        "Respect the food that needs using first",
        "The best leftover meal is often the one that saves the ingredient closest to going bad.",
        "Soft herbs, open dairy, cooked rice, salad leaves, and cooked vegetables often need attention before pantry staples do.",
        "Suggest formats, not just recipes",
        "Leftovers often work best when the format is right:",
        "- Cooked rice: fried rice, bowls, soup.",
        "- Roasted vegetables: pasta, frittata, wraps, tray bake.",
        "- Beans: stew, salad, toast topping, chilli.",
        "- Bread: toasties, breadcrumbs, panzanella-style salad.",
        "- Eggs: omelette, frittata, egg fried rice.",
        "A useful generator helps you see the shape of dinner."
      ]
    },
    {
      "heading": "A simple leftover example",
      "paragraphs": [
        "Imagine you have cooked rice, eggs, frozen peas, half an onion, and soy sauce.",
        "A useful leftover recipe generator should see egg fried rice, not a list of disconnected items.",
        "If you also have carrots, leftover chicken, spring onions, chilli oil, or sesame seeds, it should help you make that dinner better."
      ]
    },
    {
      "heading": "Why this matters",
      "paragraphs": [
        "Food waste often happens because ingredients are forgotten, not because people do not care.",
        "A leftover recipe generator helps at the exact moment where food usually gets ignored: after shopping, after cooking, and before expiry.",
        "If it helps you turn one more leftover into dinner, it has done something useful."
      ]
    }
  ],
  "delixio": {
    "heading": "Where Delixio fits",
    "paragraphs": [
      "Delixio is built around ingredient-first recipe inspiration. You type what you have at home, get meal ideas, and generate full recipes when you want more detail.",
      "You can also save recipes, build a grocery list from missing ingredients, and plan meals on a calendar.",
      "That makes it helpful for reducing everyday food waste without turning dinner into a project.",
      "Delixio does not need to pretend every suggestion is perfect. Recipes are AI-assisted suggestions, and you should always check ingredients and allergens yourself before cooking or serving."
    ]
  },
  "related": [
    {
      "slug": "leftover-recipe-generator",
      "label": "Leftover recipe generator",
      "type": "landing"
    },
    {
      "slug": "reduce-food-waste",
      "label": "Reduce food waste",
      "type": "landing"
    },
    {
      "slug": "use-ingredients-before-they-expire",
      "label": "Use ingredients before they expire",
      "type": "landing"
    }
  ],
  "image": {
    "file": "how-a-leftover-recipe-generator-helps-you-waste-less-food.webp",
    "alt": "Leftover rice, eggs, peas, carrots, and soy sauce ready to become fried rice.",
    "credit": ""
  }
}
